Bisch,Quelle_Inst,function,activity,Zeitraum,Institution,spezifische Institution,SOFISwiki_Inst/Projekt,SOFISwiki_instID/Projekt-ID
"Weins, Cornelia",Ruhr-Universität Bochum,Professorin,Lehrstuhl Empirische Sozialforschung,? - ,Ruhr-Universität Bochum,Lehrstuhl für Empirische Sozialforschung,Sektion Sozialwissenschaftliche Methoden und Statistik Lehrstuhl für Empirische Sozialforschung (Bochum),28096
"Wolf, Christoph",ORCID,Education,Dr. rer. pol.,1996,"Universität zu Köln: Koln, Nordrhein-Westfalen, Germany",Forschungsinstitut für Soziologie,Forschungsinstitut für Soziologie (Köln),4711
"Wolf, Christoph",ORCID,Employment,,2004/11-,"GESIS Leibniz Institut für Sozialwissenschaften eV: Mannheim, Baden-Württemberg, Germany",,GESIS - Leibniz-Institut für Sozialwissenschaften (Mannheim),10581
"Wolf, Christoph",GESIS,Abteilungsleiter,,2004-2015,GESIS - Leibniz-Institut für Sozialwissenschaften (Mannheim),GESIS - Leibniz-Institut für Sozialwissenschaften Abt. Dauerbeobachtung der Gesellschaft (Mannheim),GESIS - Leibniz-Institut für Sozialwissenschaften Abt. Dauerbeobachtung der Gesellschaft (Mannheim),69258
"Wolf, Christoph",ORCID,Education,Diplom Soziologe,1983/4-1988/7,"Universität Hamburg: Hamburg, Hamburg, Germany",Institut für Soziologie,Institut für Soziologie (Hamburg),9199
"Wolf, Christoph",GESIS,Professor für Soziologie,,2009-,Universität Mannheim,Professur für Methoden der empirischen Sozialforschung (Mannheim),Professur für Methoden der Empirischen Sozialforschung (Mannheim),728487
"Wolf, Christoph",ORCID,Education,Venia Legendi,2003,"Universität zu Köln: Koln, Nordrhein-Westfalen, Germany",Wirtschafts- und Sozialwissenschaftliche Fakultät,Wirtschafts- und Sozialwissenschaftliche Fakultät (Köln),9329
"Womser-Hacker, Christa",https://www.uni-hildesheim.de/fb3/institute/iwist/mitglieder/womser/wissenschaftlicher-werdegang/,Studium,n,1976 - 1984, Universität Regensburg,n, Universität Regensburg,3344
"Womser-Hacker, Christa",https://www.uni-hildesheim.de/fb3/institute/iwist/mitglieder/womser/wissenschaftlicher-werdegang/,Magister Artium,n,1984, Universität Regensburg,n, Universität Regensburg,3344
"Womser-Hacker, Christa",https://www.uni-hildesheim.de/fb3/institute/iwist/mitglieder/womser/wissenschaftlicher-werdegang/,Promotion,n,1988,Universität Regensburg,n, Universität Regensburg,3344
"Womser-Hacker, Christa",https://www.uni-hildesheim.de/fb3/institute/iwist/mitglieder/womser/wissenschaftlicher-werdegang/,Projektleitung ,n,1984 - 1997,Universität Regensburg,n, Universität Regensburg,3344
"Womser-Hacker, Christa",https://www.uni-hildesheim.de/fb3/institute/iwist/mitglieder/womser/wissenschaftlicher-werdegang/,Wissenschaftliche Assistentin/Oberassistentin,n,1991 - 1997	,Universität Regensburg,Fakultät für Informationswissenschaft, Universität Regensburg,3344
"Womser-Hacker, Christa",https://www.uni-hildesheim.de/fb3/institute/iwist/mitglieder/womser/wissenschaftlicher-werdegang/,"Ruf auf die C4-Professur ""Informationswissenschaft"" ",abgelehnt,2002,Heinrich-Heine-Universität Düsseldorf,n,Heinrich-Heine-Universität Düsseldorf (Düsseldorf),725814
"Womser-Hacker, Christa",https://www.uni-hildesheim.de/fb3/institute/iwist/mitglieder/womser/wissenschaftlicher-werdegang/,Habilitation und Venia Legendi,n,1997,n,n,n,n
"Womser-Hacker, Christa",https://www.uni-hildesheim.de/fb3/institute/iwist/mitglieder/womser/wissenschaftlicher-werdegang/,"C3-Professur für ""Angewandte Informationswissenschaft""",n,1998 - 2002, Universität Hildesheim,n,Stiftung Universität Hildesheim (Hildesheim),1534
"Womser-Hacker, Christa",https://www.uni-hildesheim.de/fb3/institute/iwist/mitglieder/womser/wissenschaftlicher-werdegang/,"C4-Professur für ""Informationswissenschaft"" ",n,seit 2002,Universität Hildesheim,n,Stiftung Universität Hildesheim (Hildesheim),1534
"Womser-Hacker, Christa",https://www.uni-hildesheim.de/fb3/institute/iwist/mitglieder/womser/wissenschaftlicher-werdegang/,"Vertretung der Professur ""Informationsmanagement""",n,1997 - 1998,Universität Konstanz,n,Universität Konstanz,3332